{"$defs":{"BudgetWire":{"additionalProperties":false,"properties":{"canonical_candidate_tokens":{"format":"uint64","minimum":0,"type":"integer"},"peak_memory_bytes":{"format":"uint64","minimum":0,"type":"integer"},"unique_candidate_event_count":{"format":"uint64","minimum":0,"type":"integer"},"unique_candidate_source_bytes":{"format":"uint64","minimum":0,"type":"integer"},"wall_time_nanos":{"format":"uint64","minimum":0,"type":"integer"}},"required":["unique_candidate_event_count","unique_candidate_source_bytes","canonical_candidate_tokens","wall_time_nanos","peak_memory_bytes"],"type":"object"}},"$id":"schemas/evidentrail/v1/bench_run_manifest.schema.json","$schema":"https://json-schema.org/draft/2020-12/schema","additionalProperties":false,"properties":{"budget":{"$ref":"#/$defs/BudgetWire"},"build_artifact_digest":{"pattern":"^artifact_sha256_[0-9a-f]{64}$","type":"string"},"contract":{"const":"evidentrail.bench.run_manifest","type":"string"},"contract_version":{"const":1,"format":"uint16","maximum":9007199254740991,"minimum":0,"type":"integer"},"dataset_artifact_digest":{"pattern":"^artifact_sha256_[0-9a-f]{64}$","type":"string"},"public_case_artifact_digests":{"items":{"type":"string"},"maxItems":4096,"type":"array"},"seed":{"format":"uint64","maximum":9007199254740991,"minimum":0,"type":"integer"},"system_artifact_digest":{"pattern":"^artifact_sha256_[0-9a-f]{64}$","type":"string"}},"required":["contract","contract_version","system_artifact_digest","build_artifact_digest","dataset_artifact_digest","seed","budget","public_case_artifact_digests"],"title":"evidentrail.bench.run_manifest","type":"object"}