{"budget":{"canonical_candidate_tokens":0,"peak_memory_bytes":0,"unique_candidate_event_count":0,"unique_candidate_source_bytes":0,"wall_time_nanos":0},"build_artifact_digest":"artifact_sha256_0000000000000000000000000000000000000000000000000000000000000000","contract":"evidentrail.bench.run_manifest","contract_version":1,"dataset_artifact_digest":"artifact_sha256_0000000000000000000000000000000000000000000000000000000000000000","public_case_artifact_digests":["artifact_sha256_0000000000000000000000000000000000000000000000000000000000000000"],"seed":0,"system_artifact_digest":"artifact_sha256_0000000000000000000000000000000000000000000000000000000000000000"}